{
  "schema_version": "portfolio-outcome.o1",
  "capability": {
    "input_mode": "SYNTHETIC_ONLY",
    "provider_history_state": "NOT_EVALUATED",
    "retention_window": {
      "starts_at": "2026-08-01T13:00:00.000Z",
      "ends_at": "2026-08-01T16:00:00.000Z",
      "pagination_state": "SYNTHETIC_COMPLETE"
    },
    "partial_fill_mode": "SUM_BY_EXECUTION_LINEAGE",
    "cancel_reorder_mode": "EXPLICIT_ORDER_LINEAGE",
    "automatic_match_confirmation": false,
    "performance_attribution": "DISABLED"
  },
  "decisions": [
    {
      "decision_id": "11111111-1111-4111-8111-111111111111",
      "instrument_id": "aaaaaaaa-aaaa-4aaa-8aaa-aaaaaaaaaaaa",
      "slice_id": "21111111-1111-4111-8111-111111111111",
      "candidate_id": null,
      "side": "SELL",
      "valid_from": "2026-08-01T13:30:00.000Z",
      "valid_until": "2026-08-01T14:30:00.000Z",
      "price_range": { "minimum": "99.000000", "maximum": "101.000000" },
      "quantity_range": { "minimum": "9.000000", "maximum": "10.000000" }
    },
    {
      "decision_id": "12222222-2222-4222-8222-222222222222",
      "instrument_id": "aaaaaaaa-aaaa-4aaa-8aaa-aaaaaaaaaaaa",
      "slice_id": "22222222-2222-4222-8222-222222222222",
      "candidate_id": null,
      "side": "SELL",
      "valid_from": "2026-08-01T13:30:00.000Z",
      "valid_until": "2026-08-01T14:30:00.000Z",
      "price_range": { "minimum": "99.000000", "maximum": "101.000000" },
      "quantity_range": { "minimum": "9.000000", "maximum": "10.000000" }
    },
    {
      "decision_id": "13333333-3333-4333-8333-333333333333",
      "instrument_id": "cccccccc-cccc-4ccc-8ccc-cccccccccccc",
      "slice_id": null,
      "candidate_id": "63333333-3333-4333-8333-333333333333",
      "side": "BUY",
      "valid_from": "2026-08-01T13:30:00.000Z",
      "valid_until": "2026-08-01T14:30:00.000Z",
      "price_range": { "minimum": "24.000000", "maximum": "26.000000" },
      "quantity_range": { "minimum": "2.000000", "maximum": "2.000000" }
    }
  ],
  "execution_lineages": [
    {
      "execution_lineage_id": "31111111-1111-4111-8111-111111111111",
      "outcome_lineage_id": "41111111-1111-4111-8111-111111111111",
      "account_ref_hash": "hmac-sha256:v1:0123456789abcdef0123456789abcdef0123456789abcdef0123456789abcdef",
      "instrument_id": "aaaaaaaa-aaaa-4aaa-8aaa-aaaaaaaaaaaa",
      "side": "SELL",
      "slice_candidate_ids": ["21111111-1111-4111-8111-111111111111"],
      "candidate_id": null,
      "orders": [
        {
          "broker_order_id": "order-unique-canceled",
          "supersedes_broker_order_id": null,
          "state": "CANCELED",
          "created_at": "2026-08-01T13:34:00.000Z"
        },
        {
          "broker_order_id": "order-unique-reordered",
          "supersedes_broker_order_id": "order-unique-canceled",
          "state": "FILLED",
          "created_at": "2026-08-01T13:42:00.000Z"
        }
      ],
      "fills": [
        {
          "broker_order_id": "order-unique-canceled",
          "broker_fill_id": "fill-unique-partial-1",
          "executed_at": "2026-08-01T13:40:00.000Z",
          "price": "100.000000",
          "quantity": "4.000000"
        },
        {
          "broker_order_id": "order-unique-reordered",
          "broker_fill_id": "fill-unique-partial-2",
          "executed_at": "2026-08-01T13:45:00.000Z",
          "price": "100.500000",
          "quantity": "6.000000"
        }
      ]
    },
    {
      "execution_lineage_id": "32222222-2222-4222-8222-222222222222",
      "outcome_lineage_id": "42222222-2222-4222-8222-222222222222",
      "account_ref_hash": "hmac-sha256:v1:123456789abcdef0123456789abcdef0123456789abcdef0123456789abcdef0",
      "instrument_id": "aaaaaaaa-aaaa-4aaa-8aaa-aaaaaaaaaaaa",
      "side": "SELL",
      "slice_candidate_ids": [
        "21111111-1111-4111-8111-111111111111",
        "22222222-2222-4222-8222-222222222222"
      ],
      "candidate_id": null,
      "orders": [
        {
          "broker_order_id": "order-ambiguous",
          "supersedes_broker_order_id": null,
          "state": "FILLED",
          "created_at": "2026-08-01T13:34:00.000Z"
        }
      ],
      "fills": [
        {
          "broker_order_id": "order-ambiguous",
          "broker_fill_id": "fill-ambiguous",
          "executed_at": "2026-08-01T13:45:00.000Z",
          "price": "100.000000",
          "quantity": "10.000000"
        }
      ]
    },
    {
      "execution_lineage_id": "33333333-3333-4333-8333-333333333333",
      "outcome_lineage_id": "43333333-3333-4333-8333-333333333333",
      "account_ref_hash": "hmac-sha256:v1:23456789abcdef0123456789abcdef0123456789abcdef0123456789abcdef01",
      "instrument_id": "bbbbbbbb-bbbb-4bbb-8bbb-bbbbbbbbbbbb",
      "side": "SELL",
      "slice_candidate_ids": ["23333333-3333-4333-8333-333333333333"],
      "candidate_id": null,
      "orders": [
        {
          "broker_order_id": "order-unlinked",
          "supersedes_broker_order_id": null,
          "state": "FILLED",
          "created_at": "2026-08-01T13:34:00.000Z"
        }
      ],
      "fills": [
        {
          "broker_order_id": "order-unlinked",
          "broker_fill_id": "fill-unlinked",
          "executed_at": "2026-08-01T13:45:00.000Z",
          "price": "50.000000",
          "quantity": "1.000000"
        }
      ]
    },
    {
      "execution_lineage_id": "35555555-5555-4555-8555-555555555555",
      "outcome_lineage_id": "45555555-5555-4555-8555-555555555555",
      "account_ref_hash": "hmac-sha256:v1:3456789abcdef0123456789abcdef0123456789abcdef0123456789abcdef012",
      "instrument_id": "cccccccc-cccc-4ccc-8ccc-cccccccccccc",
      "side": "BUY",
      "slice_candidate_ids": [],
      "candidate_id": "63333333-3333-4333-8333-333333333333",
      "orders": [
        {
          "broker_order_id": "order-candidate-buy",
          "supersedes_broker_order_id": null,
          "state": "FILLED",
          "created_at": "2026-08-01T13:40:00.000Z"
        }
      ],
      "fills": [
        {
          "broker_order_id": "order-candidate-buy",
          "broker_fill_id": "fill-candidate-buy",
          "executed_at": "2026-08-01T13:45:00.000Z",
          "price": "25.000000",
          "quantity": "2.000000"
        }
      ]
    }
  ],
  "user_events": [
    {
      "outcome_event_id": "51111111-1111-4111-8111-111111111111",
      "outcome_lineage_id": "41111111-1111-4111-8111-111111111111",
      "event_kind": "MATCH_CONFIRMATION",
      "actor_kind": "USER",
      "status": "MATCH_CONFIRMED",
      "decision_id": "11111111-1111-4111-8111-111111111111",
      "confirmed_quantity": "10.000000",
      "feedback_reason": null,
      "feedback_note_private": null,
      "supersedes_event_id": null,
      "created_at": "2026-08-01T15:00:00.000Z"
    },
    {
      "outcome_event_id": "52222222-2222-4222-8222-222222222222",
      "outcome_lineage_id": "41111111-1111-4111-8111-111111111111",
      "event_kind": "FEEDBACK",
      "actor_kind": "USER",
      "status": "MATCH_CONFIRMED",
      "decision_id": "11111111-1111-4111-8111-111111111111",
      "confirmed_quantity": "10.000000",
      "feedback_reason": "TIMING_OR_PRICE",
      "feedback_note_private": null,
      "supersedes_event_id": "51111111-1111-4111-8111-111111111111",
      "created_at": "2026-08-01T15:01:00.000Z"
    },
    {
      "outcome_event_id": "53333333-3333-4333-8333-333333333333",
      "outcome_lineage_id": "41111111-1111-4111-8111-111111111111",
      "event_kind": "CORRECTION",
      "actor_kind": "USER",
      "status": "PARTIALLY_EXECUTED",
      "decision_id": "11111111-1111-4111-8111-111111111111",
      "confirmed_quantity": "9.500000",
      "feedback_reason": "OTHER",
      "feedback_note_private": "Synthetic private correction note",
      "supersedes_event_id": "52222222-2222-4222-8222-222222222222",
      "created_at": "2026-08-01T15:02:00.000Z"
    }
  ],
  "expected_proposals": [
    {
      "outcome_lineage_id": "41111111-1111-4111-8111-111111111111",
      "execution_lineage_id": "31111111-1111-4111-8111-111111111111",
      "status": "MATCH_PROPOSED",
      "candidate_decision_ids": ["11111111-1111-4111-8111-111111111111"],
      "total_filled_quantity": "10.000000"
    },
    {
      "outcome_lineage_id": "42222222-2222-4222-8222-222222222222",
      "execution_lineage_id": "32222222-2222-4222-8222-222222222222",
      "status": "AMBIGUOUS",
      "candidate_decision_ids": [
        "11111111-1111-4111-8111-111111111111",
        "12222222-2222-4222-8222-222222222222"
      ],
      "total_filled_quantity": "10.000000"
    },
    {
      "outcome_lineage_id": "43333333-3333-4333-8333-333333333333",
      "execution_lineage_id": "33333333-3333-4333-8333-333333333333",
      "status": "UNLINKED",
      "candidate_decision_ids": [],
      "total_filled_quantity": "1.000000"
    },
    {
      "outcome_lineage_id": "45555555-5555-4555-8555-555555555555",
      "execution_lineage_id": "35555555-5555-4555-8555-555555555555",
      "status": "MATCH_PROPOSED",
      "candidate_decision_ids": ["13333333-3333-4333-8333-333333333333"],
      "total_filled_quantity": "2.000000"
    }
  ],
  "expected_public_projection": [
    {
      "outcome_lineage_id": "41111111-1111-4111-8111-111111111111",
      "status": "PARTIALLY_EXECUTED",
      "decision_id": "11111111-1111-4111-8111-111111111111",
      "feedback_reason": "OTHER",
      "last_event_id": "53333333-3333-4333-8333-333333333333",
      "last_event_at": "2026-08-01T15:02:00.000Z"
    }
  ]
}
